{
  "schema_version": 1,
  "campaign_id": "C3-T06",
  "capability": "native_loader_jni_io",
  "branch": "feature/t57-r03-va-pro-capability-campaign",
  "commit": "4a8faa64db8b6843c3ed209a97a50b3cc4ac9df5",
  "tree": "577a299ff73cc5b3e7b7c3499671baefd3580ea3",
  "timestamp": "2026-08-23T08:02:56.897706+00:00",
  "host_os": "Windows 10 AMD64",
  "android_environment": "{\"abi\": \"x86_64,arm64-v8a,x86,armeabi-v7a,armeabi\", \"adb_devices\": \"List of devices attached\\n127.0.0.1:16416        device product:PD2241 model:V2241A device:PD2241 transport_id:1\\nemulator-5556          device product:PD2241 model:V2241A device:PD2241 transport_id:2\\n\\n\", \"adb_serial\": \"127.0.0.1:16416\", \"android_id\": \"8acae00bece8090b\", \"api_level\": \"32\", \"boot_id\": \"4e8df89b-cebc-41c1-9b1e-d4abf7ac2c31\", \"device_name\": \"V2241A\", \"instance_name\": \"RD测试\", \"manufacturer\": \"vivo\", \"mumu\": {\"abiList\": \"x86_64,arm64-v8a,x86,armeabi-v7a,armeabi\", \"adb\": {\"connect\": {\"attempt\": 1, \"getState\": \"device\", \"returnCode\": 0, \"stderr\": \"\", \"stdout\": \"already connected to 127.0.0.1:16416\"}, \"devices\": \"List of devices attached\\n127.0.0.1:16416        device product:PD2241 model:V2241A device:PD2241 transport_id:1\\nemulator-5556          device product:PD2241 model:V2241A device:PD2241 transport_id:2\\n\\n\", \"getState\": \"device\", \"path\": \"adb\"}, \"androidId\": \"8acae00bece8090b\", \"api\": \"32\", \"bootId\": \"4e8df89b-cebc-41c1-9b1e-d4abf7ac2c31\", \"config\": {\"configuredHostPort\": 16416, \"configuredManufacturer\": \"vivo\", \"configuredModel\": \"V2241A\", \"extraConfig\": \"D:\\\\install\\\\Netease\\\\MuMu\\\\vms\\\\MuMuPlayer-12.0-1\\\\configs\\\\extra_config.json\", \"runtimeHost\": \"127.0.0.1\", \"runtimeHostPort\": 16416, \"vmConfig\": \"D:\\\\install\\\\Netease\\\\MuMu\\\\vms\\\\MuMuPlayer-12.0-1\\\\configs\\\\vm_config.json\"}, \"configuredSerial\": \"127.0.0.1:16416\", \"instanceId\": \"ginstance1400672403315892101\", \"instanceIndex\": 1, \"instanceName\": \"RD测试\", \"manufacturer\": \"vivo\", \"model\": \"V2241A\", \"mumuManager\": {}, \"mumuPlayerState\": \"\", \"mumuRoot\": \"D:\\\\install\\\\Netease\\\\MuMu\", \"project\": \"Controlled Android Sandbox / 闪现2\", \"release\": \"12\", \"resolvedSerial\": \"127.0.0.1:16416\", \"runtimeStatus\": \"device\", \"timestamp\": \"2026-08-23T08:02:56.422948+00:00\", \"vmName\": \"MuMuPlayer-12.0-1\"}, \"release\": \"12\"}",
  "device_name": "V2241A",
  "adb_serial": "127.0.0.1:16416",
  "api_level": "32",
  "abi": "x86_64,arm64-v8a,x86,armeabi-v7a,armeabi",
  "boot_id": "4e8df89b-cebc-41c1-9b1e-d4abf7ac2c31",
  "android_id": "8acae00bece8090b",
  "instance_name": "RD测试",
  "build_result": "NOT_APPLICABLE",
  "static_result": "PASS",
  "targeted_result": "PASS",
  "rd_result": "PASS",
  "regression_result": "NOT_APPLICABLE",
  "failures": [],
  "known_issues": [
    "C3-T06 ART/Xposed module host is out of product scope"
  ],
  "evidence_files": [
    "D:\\github\\controlled-android-sandbox\\artifacts\\capability-audit\\catch-up-c3-t06\\20260823T080254Z\\environment.json",
    "D:\\github\\controlled-android-sandbox\\artifacts\\capability-audit\\catch-up-c3-t06\\20260823T080254Z\\static-gates.json",
    "D:\\github\\controlled-android-sandbox\\artifacts\\capability-audit\\catch-up-c3-t06\\20260823T080254Z\\evidence.json",
    "D:\\github\\controlled-android-sandbox\\artifacts\\capability-audit\\catch-up-c3-t06\\20260823T080254Z\\report.md",
    "D:\\github\\controlled-android-sandbox\\verification\\catch-up\\C3-T06\\c3-t06-rd-summary.json",
    "D:\\github\\controlled-android-sandbox\\verification\\catch-up\\C3-T06\\c3-t06-local-verification.json",
    "D:\\github\\controlled-android-sandbox\\docs\\review\\C3_T06_ART_XPOSED_EXTENSION_ADR.md"
  ],
  "maturity_level": "RD_BASELINE",
  "rd_api32_only": true,
  "va_pro_equivalent": "NOT_PROVEN",
  "notes": "decision=NOT_APPLICABLE; F1-F5 continue via C2 adapters; no production Xposed/Pine engine; C5-T04 inherits this ADR"
}
