{
  "schema_version": 1,
  "campaign_id": "C3-T03",
  "capability": "four ABI ELF/page alignment, Companion32 and native Camera/Media",
  "branch": "feature/t57-r03-va-pro-capability-campaign",
  "commit": "ffcd3d1c142a30c7920aaf77b605ce9ff3386502",
  "tree": "bf8648a29c578bb765a7bb332efa042d309818c1",
  "timestamp": "2026-08-23T06:06:57.277510+00:00",
  "host_os": "Windows 10 AMD64",
  "android_environment": "{\"abi\": \"x86_64,arm64-v8a,x86,armeabi-v7a,armeabi\", \"adb_devices\": \"List of devices attached\\n127.0.0.1:16416        device product:PD2241 model:V2241A device:PD2241 transport_id:1\\nemulator-5556          device product:PD2241 model:V2241A device:PD2241 transport_id:2\\n\\n\", \"adb_serial\": \"127.0.0.1:16416\", \"android_id\": \"8acae00bece8090b\", \"api_level\": \"32\", \"boot_id\": \"4e8df89b-cebc-41c1-9b1e-d4abf7ac2c31\", \"device_name\": \"V2241A\", \"instance_name\": \"RD测试\", \"manufacturer\": \"vivo\", \"mumu\": {\"abiList\": \"x86_64,arm64-v8a,x86,armeabi-v7a,armeabi\", \"adb\": {\"connect\": {\"attempt\": 1, \"getState\": \"device\", \"returnCode\": 0, \"stderr\": \"\", \"stdout\": \"already connected to 127.0.0.1:16416\"}, \"devices\": \"List of devices attached\\n127.0.0.1:16416        device product:PD2241 model:V2241A device:PD2241 transport_id:1\\nemulator-5556          device product:PD2241 model:V2241A device:PD2241 transport_id:2\\n\\n\", \"getState\": \"device\", \"path\": \"adb\"}, \"androidId\": \"8acae00bece8090b\", \"api\": \"32\", \"bootId\": \"4e8df89b-cebc-41c1-9b1e-d4abf7ac2c31\", \"config\": {\"configuredHostPort\": 16416, \"configuredManufacturer\": \"vivo\", \"configuredModel\": \"V2241A\", \"extraConfig\": \"D:\\\\install\\\\Netease\\\\MuMu\\\\vms\\\\MuMuPlayer-12.0-1\\\\configs\\\\extra_config.json\", \"runtimeHost\": \"127.0.0.1\", \"runtimeHostPort\": 16416, \"vmConfig\": \"D:\\\\install\\\\Netease\\\\MuMu\\\\vms\\\\MuMuPlayer-12.0-1\\\\configs\\\\vm_config.json\"}, \"configuredSerial\": \"127.0.0.1:16416\", \"instanceId\": \"ginstance1400672403315892101\", \"instanceIndex\": 1, \"instanceName\": \"RD测试\", \"manufacturer\": \"vivo\", \"model\": \"V2241A\", \"mumuManager\": {}, \"mumuPlayerState\": \"\", \"mumuRoot\": \"D:\\\\install\\\\Netease\\\\MuMu\", \"project\": \"Controlled Android Sandbox / 闪现2\", \"release\": \"12\", \"resolvedSerial\": \"127.0.0.1:16416\", \"runtimeStatus\": \"device\", \"timestamp\": \"2026-08-23T06:06:32.708175+00:00\", \"vmName\": \"MuMuPlayer-12.0-1\"}, \"page_size\": 4096, \"page_size_command\": \"getconf PAGE_SIZE\", \"release\": \"12\"}",
  "device_name": "V2241A",
  "adb_serial": "127.0.0.1:16416",
  "api_level": "32",
  "abi": "x86_64,arm64-v8a,x86,armeabi-v7a,armeabi",
  "boot_id": "4e8df89b-cebc-41c1-9b1e-d4abf7ac2c31",
  "android_id": "8acae00bece8090b",
  "instance_name": "RD测试",
  "build_result": "PASS",
  "static_result": "PASS",
  "targeted_result": "PASS",
  "rd_result": "PASS",
  "regression_result": "UNVERIFIED",
  "failures": [
    {
      "id": "KI-R03-043",
      "classification": "ENVIRONMENT_BLOCKED",
      "summary": "RD page size is 4096; 16KB/ARM dynamic runtime is not available",
      "known_issue_id": "KI-R03-043"
    }
  ],
  "known_issues": [
    "KI-R03-043 ARM and 16KB dynamic environments unavailable",
    "KI-R03-NATIVE-001 raw syscall/SVC remains outside PLT mediation"
  ],
  "evidence_files": [
    "D:\\github\\controlled-android-sandbox\\artifacts\\capability-audit\\catch-up-c3-t03\\20260823T060630Z\\environment.json",
    "D:\\github\\controlled-android-sandbox\\artifacts\\capability-audit\\catch-up-c3-t03\\20260823T060630Z\\build-metadata.json",
    "D:\\github\\controlled-android-sandbox\\artifacts\\capability-audit\\catch-up-c3-t03\\20260823T060630Z\\static-gates.json",
    "D:\\github\\controlled-android-sandbox\\artifacts\\capability-audit\\catch-up-c3-t03\\20260823T060630Z\\direct64.json",
    "D:\\github\\controlled-android-sandbox\\artifacts\\capability-audit\\catch-up-c3-t03\\20260823T060630Z\\direct32.json",
    "D:\\github\\controlled-android-sandbox\\artifacts\\capability-audit\\catch-up-c3-t03\\20260823T060630Z\\sandbox.json",
    "D:\\github\\controlled-android-sandbox\\artifacts\\capability-audit\\catch-up-c3-t03\\20260823T060630Z\\companion.json",
    "D:\\github\\controlled-android-sandbox\\verification\\catch-up\\C3-T03\\c3-t03-abi-report.json",
    "D:\\github\\controlled-android-sandbox\\verification\\catch-up\\C3-T03\\c3-t03-environment-block.json",
    "D:\\github\\controlled-android-sandbox\\artifacts\\capability-audit\\catch-up-c3-t03\\20260823T060630Z\\evidence.json",
    "D:\\github\\controlled-android-sandbox\\artifacts\\capability-audit\\catch-up-c3-t03\\20260823T060630Z\\report.md",
    "D:\\github\\controlled-android-sandbox\\verification\\catch-up\\C3-T03\\c3-t03-rd-summary.json",
    "D:\\github\\controlled-android-sandbox\\verification\\catch-up\\C3-T03\\c3-t03-local-verification.json"
  ],
  "maturity_level": "RD_BASELINE",
  "rd_api32_only": true,
  "va_pro_equivalent": "NOT_PROVEN",
  "notes": "Four-ABI ELF static alignment and RD API32 x86/x86_64 native media paths are reported separately. RD page size is recorded explicitly; ARM and 16KB dynamic claims remain unverified/environment-blocked."
}
